{
  "build_channel": "nightly",
  "build_version": "74.0a1",
  "os_version": "10.0.18363.592",
  "os_locale": "en-US",
  "default_browser": "firefox",
  "previous_default_browser": "edge",
  "client_id": "98D8A499-DBA0-4340-A058-64CF35986FFB",
  "notification_type": "initial",
  "notification_shown": "shown",
  "notification_action": "dismissed-by-timeout"
}
